{"schema_version":"1.0.0","id":"data-analyst","name":"Quarterly data analyst","short_description":"Turn a metric question into a typed query, calculation and validated answer.","domain":"analytics","difficulty":"beginner","concepts":["structured output","calculation","evaluation"],"data_classification":"public_fixture","default_graph_id":"metric-analysis-graph","tool_catalog_ref":"tools.json","lesson_ref":"lessons.json","eval_ref":"evals.jsonl","policy_ref":"policies.json","fault_ref":"faults.json","local_only":true,"license":"CC0-1.0","maintainer":{"name":"AGENT//TRACE"},"compatibility":{"core":">=0.1.0 <0.2.0","event_schema":"1.0.0","required_capabilities":["typed_tools","deterministic_mock"]},"tags":["offline","analytics","schema"]}
