{
  "schema_version": "1.0.0",
  "id": "data-analyst",
  "name": "Data Analyst Copilot",
  "short_description": "Query fictional commerce metrics, calculate changes, and produce a safe chart specification.",
  "domain": "analytics",
  "difficulty": "intermediate",
  "concepts": [
    "structured_output",
    "tool_calling",
    "deterministic_compute",
    "chart_dsl",
    "evaluation"
  ],
  "data_classification": "public_fixture",
  "default_graph_id": "data-analyst-main",
  "tool_catalog_ref": "tools.json",
  "lesson_ref": "lessons.json",
  "eval_ref": "evals.jsonl",
  "policy_ref": "policies.json",
  "fault_ref": "faults.json",
  "local_only": true,
  "license": "CC0-1.0",
  "maintainer": {
    "name": "AGENT//TRACE sample maintainers"
  },
  "compatibility": {
    "core": ">=0.1.0 <0.2.0",
    "event_schema": "1.0.0",
    "required_capabilities": [
      "structured_output",
      "typed_events"
    ]
  },
  "tags": [
    "analytics",
    "fictional",
    "offline"
  ]
}
