{"schema_version":"1.0.0","id":"customer-support","name":"Customer support triage","short_description":"Route a fictional support request through typed tools and visible policy checks.","domain":"support","difficulty":"beginner","concepts":["routing","tools","guardrails"],"data_classification":"public_fixture","default_graph_id":"support-triage-graph","tool_catalog_ref":"tools.json","lesson_ref":"lessons.json","eval_ref":"evals.jsonl","policy_ref":"policies.json","fault_ref":"faults.json","local_only":true,"license":"CC0-1.0","maintainer":{"name":"AGENT//TRACE"},"compatibility":{"core":">=0.1.0 <0.2.0","event_schema":"1.0.0","required_capabilities":["typed_tools","deterministic_mock"]},"tags":["offline","support","tool-loop"]}
