{
  "schema_version": "1.0.0",
  "id": "research-synthesis",
  "name": "Research Synthesis Desk",
  "short_description": "Synthesize local reports with version conflicts, authority differences, and citation requirements.",
  "domain": "research",
  "difficulty": "intermediate",
  "concepts": [
    "retrieval",
    "evidence",
    "citations",
    "conflict_resolution",
    "evaluation"
  ],
  "data_classification": "public_fixture",
  "default_graph_id": "research-synthesis-main",
  "tool_catalog_ref": "tools.json",
  "lesson_ref": "lessons.json",
  "eval_ref": "evals.jsonl",
  "policy_ref": "policies.json",
  "fault_ref": "faults.json",
  "local_only": true,
  "license": "CC0-1.0",
  "maintainer": {
    "name": "AGENT//TRACE sample maintainers"
  },
  "compatibility": {
    "core": ">=0.1.0 <0.2.0",
    "event_schema": "1.0.0",
    "required_capabilities": [
      "structured_output",
      "typed_events"
    ]
  },
  "tags": [
    "research",
    "fictional",
    "offline"
  ]
}
