{
  "schema_version": "1.0.0",
  "id": "risk-investigation",
  "name": "Vendor risk investigation",
  "short_description": "Compare current, superseded and conflicting vendor-risk evidence with explicit lineage.",
  "domain": "risk",
  "difficulty": "intermediate",
  "concepts": ["retrieval", "evidence", "conflict", "provenance"],
  "data_classification": "public_fixture",
  "default_graph_id": "risk-evidence-graph",
  "tool_catalog_ref": "tools.json",
  "lesson_ref": "lessons.json",
  "eval_ref": "evals.jsonl",
  "policy_ref": "policies.json",
  "fault_ref": "faults.json",
  "local_only": true,
  "license": "CC0-1.0",
  "maintainer": {"name": "AGENT//TRACE"},
  "compatibility": {
    "core": ">=0.1.0 <0.2.0",
    "event_schema": "1.0.0",
    "required_capabilities": ["sqlite_fts5", "typed_evidence", "deterministic_mock"]
  },
  "tags": ["offline", "risk", "conflict"]
}
