{
  "schema_version": "1.0.0",
  "id": "travel-planner",
  "name": "Constraint-aware Travel Planner",
  "short_description": "Plan a fictional city itinerary under budget, opening-hour, mobility, and approval constraints.",
  "domain": "planning",
  "difficulty": "intermediate",
  "concepts": [
    "clarification",
    "planning",
    "parallel_tools",
    "constraint_validation",
    "approval"
  ],
  "data_classification": "public_fixture",
  "default_graph_id": "travel-planner-main",
  "tool_catalog_ref": "tools.json",
  "lesson_ref": "lessons.json",
  "eval_ref": "evals.jsonl",
  "policy_ref": "policies.json",
  "fault_ref": "faults.json",
  "local_only": true,
  "license": "CC0-1.0",
  "maintainer": {
    "name": "AGENT//TRACE sample maintainers"
  },
  "compatibility": {
    "core": ">=0.1.0 <0.2.0",
    "event_schema": "1.0.0",
    "required_capabilities": [
      "structured_output",
      "typed_events"
    ]
  },
  "tags": [
    "planning",
    "fictional",
    "offline"
  ]
}
