{"schema_version":"1.0.0","id":"incident-response","name":"Incident response stream","short_description":"Trace a fictional incident through streamed events, recovery and evidence.","domain":"operations","difficulty":"advanced","concepts":["streaming","faults","recovery"],"data_classification":"public_fixture","default_graph_id":"incident-response-graph","tool_catalog_ref":"tools.json","lesson_ref":"lessons.json","eval_ref":"evals.jsonl","policy_ref":"policies.json","fault_ref":"faults.json","local_only":true,"license":"CC0-1.0","maintainer":{"name":"AGENT//TRACE"},"compatibility":{"core":">=0.1.0 <0.2.0","event_schema":"1.0.0","required_capabilities":["deterministic_mock","typed_evidence"]},"tags":["offline","incident","events"]}
