{"schema_version":"1.0.0","id":"workflow-approval","name":"Human approval workflow","short_description":"Pause a fictional write at a durable approval boundary and resume safely.","domain":"workflow","difficulty":"advanced","concepts":["approval","interrupt","idempotency"],"data_classification":"public_fixture","default_graph_id":"approval-write-graph","tool_catalog_ref":"tools.json","lesson_ref":"lessons.json","eval_ref":"evals.jsonl","policy_ref":"policies.json","fault_ref":"faults.json","local_only":true,"license":"CC0-1.0","maintainer":{"name":"AGENT//TRACE"},"compatibility":{"core":">=0.1.0 <0.2.0","event_schema":"1.0.0","required_capabilities":["approval_checkpoint","deterministic_mock","typed_tools"]},"tags":["offline","approval","write"]}
