{"schema_version":"1.0.0","id":"travel-planner","name":"Constraint-aware travel planner","short_description":"Route a fictional itinerary through explicit constraints and validation.","domain":"travel","difficulty":"intermediate","concepts":["state","conditional edges","constraints"],"data_classification":"public_fixture","default_graph_id":"travel-constraint-graph","tool_catalog_ref":"tools.json","lesson_ref":"lessons.json","eval_ref":"evals.jsonl","policy_ref":"policies.json","fault_ref":"faults.json","local_only":true,"license":"CC0-1.0","maintainer":{"name":"AGENT//TRACE"},"compatibility":{"core":">=0.1.0 <0.2.0","event_schema":"1.0.0","required_capabilities":["typed_tools","deterministic_mock"]},"tags":["offline","travel","state"]}
